nama,no_telp,alamat,latitude,longitude,kategori_1,kategori_2,kategori_3,kategori_4,kategori_5,id
KILOHANA Laundry Kiloan dan Satuan,081234567891,"Jl. Raya Perjuangan No.69, RT.002/RW.008, Harapan Baru, Bekasi Utara, Bekasi, West Java 17123",0.10511149974339162,0.39330749611967164,1,0,0,0,0,553
Essii Laundry,081234567891,"Perum Kelapa Indah Blk B IV, RT.14/RW.1, Pd. Klp., Kota Jakarta Timur, Daerah Khusus Ibukota Jakarta 13450",0.10070455083413976,0.3911168833820078,0,1,0,0,0,554
Sip Coin Laundry Express,081234567891,"Jl. Pagelarang, Jatiwarna, Pondok Melati, Bekasi, West Java 17415",0.10931015799687716,0.391606214191242,0,1,0,0,0,555
ALFA LAUNDRY COIN EXPRESS 3 JAM SELESAI,081234567891,"Ruko Trivium Square No. 22, Jl. Kemang Raya, Sukaresmi, Cikarang Selatan, Bekasi Regency, West Java 17530",0.10790795109313678,0.39349461423689824,1,1,1,1,1,556
Apparel Clinic ( cuci ),081234567891,"QX6Q+Q2M Cuci Kiloan Apsari Laundry & Dry Clean, Jl. Tampomas I, RT.002/RW.018, Kayuringin Jaya, Kec. Bekasi Sel., Kota Bks, Jawa Barat 17144",0.10853381836765263,0.3957826733965595,0,1,1,1,0,557
Cleando Laundry,081234567891,"Jl Delima 3 No.3, RT.1/RW.13, Duren Jaya, Kec. Bekasi Tim., Kota Bks, Jawa Barat 17111",0.1067757438926139,0.39232921608288507,0,1,1,0,1,558
5asec Cikini Raya,081234567891,"Jl. Bumi Anggrek Raya No.29, Karangsatria, Kec. Tambun Utara, Kabupaten Bekasi, Jawa Barat 17510",0.10545298060128139,0.392452466966116,0,0,0,0,1,559
Kwik Wash Laundry,081234567891,"QXQM+PJV Bintara Laundry & Dry Cleaning, Jl. Bengawan Solo III, RT.003/RW.008, Harapan Jaya, Kec. Bekasi Utara, Kota Bks, Jawa Barat 17124",0.09753467831308815,0.3918582011943794,0,0,0,1,1,560
Express Laundry jakarta,081234567891,"Jl. Pilar Sukatani, RT.003/RW.003, Sukaraya, Kec. Karangbahagia, Kabupaten Bekasi, Jawa Barat 17530",0.10420196991204378,0.3929901155558113,1,1,1,0,1,561
Zap Laundry Menteng Park,081234567891,"Jl.Patriot Raya 62a Rt 002/022 Kel, RT.002/RW.022, Aren Jaya, Kec. Bekasi Tim., Kota Bks, Jawa Barat 17111",0.10541868774353347,0.3925946538403071,1,1,1,1,1,562
LaundyinAja,081234567891,"Jl. Nangka, RT.006/RW.005, Bojong Rawalumbu, Kec. Rawalumbu, Kota Bks, Jawa Barat 17116",0.10296498400631782,0.3953554927037528,1,0,1,1,1,563
5asec Kelapa Gading,081234567891,"Kemilau Laundry ( sebelum rel kereta, Jl. Aren Jaya, RT.001/RW.005, Setiamekar, Kec. Tambun Sel., Kota Bks, Jawa Barat 17510",0.10844025948925895,0.3957676009201263,0,0,1,0,0,564
Londri Laundry,081234567891,"Jl. Boulevard Raya No.52, RT.001/RW.002, Jaka Setia, Kec. Bekasi Sel., Kota Bks, Jawa Barat 17147",0.10847952888309154,0.392235680873128,1,1,1,1,1,565
"SMART LAUNDRY SERVICE - Cuci Karpet, Cuci Sofa, Cuci Gorden , Service Sofa. Area LAYANAN JABODETABEK.",081234567891,"Depan ALFAMART Kedasih, Jl. Kedasih IV, Mekarmukti, Kec. Cikarang Utara, Kabupaten Bekasi, Jawa Barat 17530",0.0986152200208037,0.3891952857300325,1,0,0,0,0,566
APIQUE Laundry Setiabudi,081234567891,"Jl. Antilop V No.87, Jayamukti, Central Cikarang, Bekasi Regency, West Java 17530",0.10373417552007513,0.3919343267399036,0,0,0,0,1,567
Kota Laundry Express Cempaka Putih Jakarta Pusat,081234567891,"QW5Q+Q78 Laundry, RT.5/RW.2, Pd. Klp., Kec. Duren Sawit, Kota Jakarta Timur, Daerah Khusus Ibukota Jakarta 13450",0.10664273465543905,0.39411597230804407,1,0,0,0,0,568
5asec Gatot Subroto,081234567891,"Ruko Ventura Jalan Gunung Panderman Blok E/15 Lippo Cikarang, Cibatu, Cikarang Sel., Kabupaten Bekasi, Jawa Barat 17530",0.10066709108979255,0.39267554915685476,0,1,1,1,1,569
Taurus laundry,081234567891,"Jl. Bekasi Timur Raya No.5A, RT.5/RW.8, Cipinang, Kec. Pulo Gadung, Kota Jakarta Timur, Daerah Khusus Ibukota Jakarta 13240",0.09924054440047392,0.3912886905342505,0,1,1,1,1,570
Herado Laundry,081234567891,"QWWX+5V5 Tioman's Laundries, Apartemen Sentra Timur Tower Hijau No, RT.8/RW.6, Pulo Gebang, Kec. Cakung, Kota Jakarta Timur, Daerah Khusus Ibukota Jakarta 13950",0.09527107825431069,0.39140450057468623,1,1,1,1,1,571
VIRGI LAUNDRY,081234567891,"Jl. Gading Raya No.703, RT.5/RW.8, Pd. Bambu, Kec. Duren Sawit, Kota Jakarta Timur, Daerah Khusus Ibukota Jakarta 13430",0.10724263345983986,0.38740328275674774,1,1,1,1,1,572
Arlet Laundry Tebet TDR,081234567891,"Jl. Mekar Sari No.87, RT.008/RW.014, Bekasi Jaya, Bekasi Timur, Bekasi, West Java 17112",0.10140298505301903,0.3933602497871851,0,0,0,0,1,573
V2 LAUNDRY,081234567891,"Jalan Raya Pisangan RT 06 RW 03 #2 Satria Mekar Tambun Utara Bekasi, Satriamekar, Kec. Tambun Utara, Kota Bks, Jawa Barat 17510",0.1001146051019085,0.3921472016206531,0,1,1,1,1,574
5asec Merdeka Barat,081234567891,"2, Jl. Pangkalan Jati I No.14, RT.2/RW.13, Cipinang Melayu, Kec. Makasar, Kota Jakarta Timur, Daerah Khusus Ibukota Jakarta 13620",0.10671611594207087,0.3912554929279324,0,1,1,1,1,575
SUPER LAUNDRY,081234567891,"Jalan Kelapa Hibrida Timur Blok RB-8 Nomor 11A, Pegangsaan Dua, Kelapa Gading",0.09680873742203122,0.3904352831028426,1,1,1,1,0,576
De Cleaner Laundry & Dry clean,081234567891,"Jl. Bendungan Hilir XIII No.41, RT.4/RW.3, Bend. Hilir, Kecamatan Tanah Abang, Kota Jakarta Pusat, Daerah Khusus Ibukota Jakarta 10210",0.1115234497999612,0.3900946737541009,0,1,0,0,0,577
Indo Express Laundry (Mampang VIII),081234567891,"Jl. Gandaria Tengah II No.26, Kramat Pela, Kebayoran Baru, South Jakarta City, Jakarta 12130",0.10017124713080061,0.3919879866639109,0,0,1,1,1,578
Sunwash laundry ( Dry cleaning & laundry kilo ),081234567891,"Jl. Mangga Besar XIII No.111c, RT.14/RW.2, Mangga Dua Sel., Kecamatan Sawah Besar, Kota Jakarta Pusat, Daerah Khusus Ibukota Jakarta 10730",0.11001103524256173,0.39369379987481246,1,1,1,1,1,579
Joy Wash Laundry,081234567891,"5, Jl. Johar No.23, RT.5/RW.3, Gondangdia, Kec. Menteng, Kota Jakarta Pusat, Daerah Khusus Ibukota Jakarta 10350",0.09911251169938384,0.3895706667095311,1,1,1,1,1,580
Mr Clean Laundry Center,081234567891,"Jl. Cikini Raya No.40, RT.12/RW.5, Cikini, Menteng, Central Jakarta City, Jakarta 10330",0.10043156520927143,0.39382229750616826,1,0,1,1,0,581
Djaya Laundry Gilisampeng,081234567891,"RT.5/RW.8, 8, Bendungan Hilir, Tanah Abang, Central Jakarta City, Jakarta 10210",0.10510489452277005,0.38947140777454514,1,0,0,0,0,582
Pure Laundry,081234567891,"Jl. Kramat Kwitang I No.34, RT.2/RW.5, Kwitang, Kec. Senen, Kota Jakarta Pusat, Daerah Khusus Ibukota Jakarta 10420",0.10471057189990751,0.38835256258571604,0,0,1,0,0,583
LaundryKlin Apartemen Gardenia (Laundry Antar Jemput Pejaten),081234567891,"Jl. Duku Raya No.6B, RT.6/RW.5, North Kebayoran Lama, Kebayoran Lama, South Jakarta City, Jakarta 12240",0.09692455498909502,0.3919376178819096,1,0,0,1,1,584
Laundry Terdekat,081234567891,"Jl. Mardani Raya No.11a, RT.2/RW.5, Johar Baru, Kec. Johar Baru, Kota Jakarta Pusat, Daerah Khusus Ibukota Jakarta 10560",0.11020747269419884,0.38983834625933333,1,0,0,0,1,585
Flash Coin Laundry - Sunter Hijau,081234567891,"Dibawah Kos Hijau, Jl. Alpukat 3 No.42, RT.2/RW.2, Tj. Duren Utara, Jakarta, Kota Jakarta Barat, Daerah Khusus Ibukota Jakarta 11470",0.1084446931304981,0.3943262238147325,1,0,0,1,0,586
Dewasz Laundry & Dry Cleaning,081234567891,"15, Jl. Tebet Barat V No.12, RT.15/RW.4, Tebet Bar., Kec. Tebet, Jakarta, Daerah Khusus Ibukota Jakarta 12810",0.10708130320821896,0.39535382328389446,0,0,0,1,0,587
"Cuci Karpet Kantor, Gorden Sofa Springbed, Blackout | Health IndoCareService",081234567891,"Patokan Seberang Alfamart, Jl. Lautze No.32A, RT.4/RW.7, Ps. Baru, Kecamatan Sawah Besar, Daerah Khusus Ibukota Jakarta 10710",0.09831518013612905,0.389423805459737,1,1,1,1,1,588
Londriinaja,081234567891,"Jl. Camar 3 No.27, RT.1/RW.10, West Semper, Cilincing, North Jakarta City, Jakarta 14130",0.09398767483928494,0.39250588840157175,1,1,1,0,1,589
FILOLI DailyLaundry++ Pegambiran Head Office,081234567891,"Jl. Bri Radio Dalam H No.4A, RT.7/RW.4, Gandaria Utara, Kec. Kby. Baru, Kota Jakarta Selatan, Daerah Khusus Ibukota Jakarta 12140",0.10457530060087594,0.3949299337330938,0,1,0,1,0,590
Lovely laundry,081234567891,"4 no, Jl. Kernolong Dalam 4 No.44 -48, RT.5/RW.8, Kenari, Kec. Senen, Kota Jakarta Pusat, Daerah Khusus Ibukota Jakarta 10430",0.10897383464002086,0.38633270765066907,0,1,0,0,1,591
SKY88 Laundry,081234567891,"Jl. Karbela Timur No.13, RT.9/RW.4, Kuningan, Karet, Setiabudi, South Jakarta City, Jakarta 12920",0.09850130258569956,0.3902841767568388,1,1,0,1,0,592
Tifa Laundry Express,081234567891,"Jl. Industri 3 No.32, RT.10/RW.1, North Gunung Sahari, Sawah Besar, Central Jakarta City, Jakarta 10720",0.10793048122922966,0.3914188575854647,1,0,0,0,0,593
CUCI HELM Wash Master KEMAYORAN,081234567891,"Sudirman Park, Rukan, Jl. K.H. Mas Mansyur No.Kav.35, RT.12/RW.11, Karet Tengsin, Tanah Abang, Central Jakarta City, Jakarta 10250",0.10815569210768416,0.39324248414063057,1,1,1,1,1,594
Kwiklin Laundry,081234567891,"Jl. Cipinang Jaya Raya No.39, RT.2/RW.6, Cipinang Muara, Jatinegara, East Jakarta City, Jakarta 13410",0.10925921636386404,0.39618495588462643,0,1,0,0,1,595
JEEVES - Kemang,081234567891,"Jl. Prof. DR. Satrio No.248A, RT.1/RW.6, Kuningan, Karet Kuningan, Kecamatan Setiabudi, Kota Jakarta Selatan, Daerah Khusus Ibukota Jakarta 12930",0.09900936167871766,0.39136724866299755,0,0,1,0,1,596
i Wash (Laundromat) by Huebsch - USA,081234567891,"Jl. Camar 3 No.27, RT.1/RW.10, West Semper, Cilincing, North Jakarta City, Jakarta 14130",0.10893809406268473,0.3917423911539437,1,1,1,1,1,597
Martinizing Dry Cleaning Cempaka Putih,081234567891,"Jl. Raya Klp. Gading Permai No.2, RT.10/RW.2, Klp. Gading Tim., Kec. Klp. Gading, Jkt Utara, Daerah Khusus Ibukota Jakarta 14240",0.10684957759161706,0.3938926993264653,0,1,1,1,0,598
LONDRENIA LAUNDRY EXPRESS,081234567891,"Jl. H. Nawi Raya No.9C, RT.3/RW.7, Gandaria Utara, Kec. Kby. Baru, Kota Jakarta Selatan, Daerah Khusus Ibukota Jakarta 12140",0.1043158873471478,0.3901083152992264,0,1,0,0,0,599
Antaris Laundry,081234567891,"Kilohana Laundry, Jl. Salemba Tengah Ruko putih pagar putih No.65, RT.9/RW.8, Paseban, Senen, Central Jakarta City, Jakarta 10440",0.10529726026306507,0.39500729941908475,0,1,1,1,0,600
Easy Wash Coin Laundry,081234567891,"Jalan Cikajang Raya No.46, RT.13/RW.6, Petogogan, Kec. Kby. Baru, Kota Jakarta Selatan, Daerah Khusus Ibukota Jakarta 12170",0.1057084126261415,0.3946889172033101,1,1,1,1,1,601
KOIN LAUNDRY KILOAN DAN LAUNDRY SATUAN KEMANG,081234567891,"14, Jl. Labu No.137, RT.1/RW.9, Mangga Besar, Kec. Taman Sari, Kota Jakarta Barat, Daerah Khusus Ibukota Jakarta 11180",0.09792004317099812,0.3913552288400197,1,1,1,1,1,602
Freshclin Center,081234567891,"Jl. Serdang Raya No.32, RT.1/RW.10, Cemp. Baru, Kec. Kemayoran, Kota Jakarta Pusat, Daerah Khusus Ibukota Jakarta 10640",0.1010246778281021,0.39299178497566967,1,0,0,1,1,603
Jaksa Clean Coin Laundry,081234567891,"Jl. Pelepah Indah I No.mor 4, RT.12/RW.18, Klp. Gading Tim., Kec. Klp. Gading, Jkt Utara, Daerah Khusus Ibukota Jakarta 14240",0.10584051703857378,0.3920317731619001,1,0,1,0,1,604
Kireiwash • Kirei Wash & Beyond - Kelapa Gading,081234567891,"Mess Pa Denma Mabesad, Jl. Raden Abdul Rahman Saleh No.18, RT.9/RW.5, Gambir, Kec. Senen, Kota Jakarta Pusat, Daerah Khusus Ibukota Jakarta 10410",0.10899555043384535,0.3950713574439213,1,1,1,0,1,605
One Night Stain Laundry CILANDAK,081234567891,"Jl. Cikini 1 No.69B, RT.16/RW.1, Cikini, Kec. Menteng, Kota Jakarta Pusat, Daerah Khusus Ibukota Jakarta 10330",0.09596335966493974,0.39027458951708294,1,1,0,0,0,606
"Laundry Rungkut Surabaya ""Rumah Laundry""",081234567891,"Jl. Pejaten Barat Raya No.40A, RT.2/RW.8, West Pejaten, Pasar Minggu, South Jakarta City, Jakarta 12540",0.002605714293986927,0.6757323160620077,0,0,0,1,0,607
Ryns Laundry,081234567891,"Jl. Raya Pulo Gebang No.34, RT.14/RW.4, Ujung Menteng, Kec. Cakung, Kota Jakarta Timur, Daerah Khusus Ibukota Jakarta 13960",0.0031159449663874517,0.6748606404075828,1,1,1,1,1,608
Gowash Satrio Laundry,081234567891,"3, Jl. Tambak No.15a, RT.3/RW.5, Pegangsaan, Kec. Menteng, Kota Jakarta Pusat, Daerah Khusus Ibukota Jakarta 10320",0.10265300043503967,0.391640795031158,0,0,0,0,1,609
@HOME Laundry Indonesia,081234567891,"Apartemen Menteng Park Tower Diamond, T 13 B, RT.2/RW.2, Cikini, Kec. Menteng, Kota Jakarta Pusat, Daerah Khusus Ibukota Jakarta 10330",0.0013620326851651043,0.6738328978452897,1,1,0,1,1,610
LaundryKlin,081234567891,"Jl. Pertanian Sel. No.30, RT.12/RW.3, Klender, Durensawit, East Jakarta City, Jakarta 13470",0.007357039500305085,0.6747354816159428,1,1,1,1,1,611
Yuk Laundry Surabaya,081234567891,"Jl. Boulevard Raya, RT.12/RW.18, Klp. Gading Tim., Kec. Klp. Gading, Jkt Utara, Daerah Khusus Ibukota Jakarta 14240",0.00816577185531775,0.6766182533317924,0,1,1,0,0,612
Natura Laundry & Dry Clean Nginden,081234567891,"Jl. Kartini IV Dalam No.128 C, Kartini, Sawah Besar, Central Jakarta City, Jakarta 10750",0.004529824109308578,0.6750065954008813,0,1,1,1,1,613
Glory Go Laundry Self Service Petemon Kali,081234567891,"Perum Kelapa Indah Blk B IV, RT.14/RW.1, Pd. Klp., Kota Jakarta Timur, Daerah Khusus Ibukota Jakarta 13450",0.007878851929412067,0.6731957518320568,0,1,1,0,1,614
Rumah Express Laundry,081234567891,"Jl. H.Muhi VIIIA No.58, RT.7/RW.4, Pd. Pinang, Kec. Kby. Lama, Daerah Khusus Ibukota Jakarta 12310",0.008293714073933534,0.6737745635456793,1,1,1,0,1,615
DND Laundry & Shoes Treatment,081234567891,"depan Resto Mbah Jingkrak, Jl. Setia Budi Tengah No.20, RT.1/RW.1, Kuningan, Setia Budi, Kecamatan Setiabudi, Kota Jakarta Selatan, Daerah Khusus Ibukota Jakarta 12910",0.10716364225980335,0.38995215299593866,0,0,0,1,1,616
King laundry,081234567891,"Jl. Cempaka Putih Raya No.129b, RT.6/RW.6, Cemp. Putih Tim., Kec. Cemp. Putih, Kota Jakarta Pusat, Daerah Khusus Ibukota Jakarta 10510",0.10940263108557968,0.3880293152034975,1,1,1,1,0,617
Netto Laundromat Wiyung,081234567891,"Jl. Gatot Subroto No.300, Menteng Dalam, Tebet, South Jakarta City, Jakarta 12780",0.0037330354408993127,0.6717502727235827,0,0,1,0,0,618
Wish Wash,081234567891,"Jalan Kemang I No.10A RT. 010/ 005, RT.10/RW.5, Bangka, Kec. Mampang Prpt., Kota Jakarta Selatan, Daerah Khusus Ibukota Jakarta 12730",0.005968404967704899,0.6727009834838569,1,1,1,1,1,619
Oxy Laundry Margorejo,081234567891,"Jl. Villa Taman Bandara No.9, Dadap, Kec. Kosambi, Kabupaten Tangerang, Daerah Khusus Ibukota Jakarta 15211",0.003421866211889557,0.6738592746790459,1,0,1,0,0,620
IPSO Laundromat,081234567891,"Jl. Kp. Utan No.36, RT.15/RW.5, Ragunan, Pasar Minggu, South Jakarta City, Jakarta 12550",0.0063644467575785235,0.672815362592984,1,0,1,1,1,621
Mama's Laundry Lounge,081234567891,"Jl. Mawar Merah No.37, RT.6/RW.1, Pd. Kopi, Kec. Duren Sawit, Kota Jakarta Timur, Daerah Khusus Ibukota Jakarta 13460",0.10769043122499511,0.3919170601688009,1,1,0,0,1,622
LAUNDRY TIME,081234567891,"Jl. Perserikatan No.4 A- B, RT.2/RW.8, Rawamangun, Kec. Pulo Gadung, Kota Jakarta Timur, Daerah Khusus Ibukota Jakarta 13220",0.0034871945583115904,0.6735064070187748,1,1,1,1,1,623
Laundry The Daily Wash Coin Menganti,081234567891,"Apt. Bintaro Park View Tower A, Jl. Bintaro Permai No.5, Daerah Khusus Ibukota Jakarta 12320",0.004367589032944985,0.67038659518815,1,1,1,0,1,624
Tempat Laundry,081234567891,"RPJJ+4R8 VIRGI LAUNDRY, RT.15, Rw. Buaya, Kecamatan Cengkareng, Kota Jakarta Barat, Daerah Khusus Ibukota Jakarta 11740",0.010121912466530492,0.6747033333592487,0,1,0,0,0,625
D2C LAUNDRY & WET CLEAN (www.LaundrySurabaya.com),081234567891,"Jl. Tebet Timur Dalam Raya No.2C, East Tebet, Tebet, South Jakarta City, Jakarta 12820",0.0061322687286053945,0.6699369965715363,1,1,1,1,1,626
LAUNDRY DEWE JOJORAN,081234567891,"Citra Garden 2 Extension Blok BE2 No. 31, RT.3/RW.20, Pegadungan, Kec. Kalideres, Kota Jakarta Barat, Daerah Khusus Ibukota Jakarta 11839",0.007455574914783547,0.6751708663149083,1,1,1,1,1,627
Classy Laundry & Dryclean Darmo Permai,081234567891,"Jl. Buaran Raya No.4, RT.4/RW.12, Klender, Durensawit, East Jakarta City, Jakarta 13440",0.0066067588236699,0.6718630778082728,0,1,1,0,1,628
LAUNDRY BERKAH,081234567891,"Jl. Tegal Parang Sel. No.11, RT.5/RW.1, Tegal Parang, Kec. Mampang Prpt., Kota Jakarta Selatan, Daerah Khusus Ibukota Jakarta 12790",0.00875644144734311,0.6751856049073695,1,1,1,0,1,629
Griya Express Laundry,081234567891,"Jl. Tanah Abang II No.79, RT.1/RW.4, Cideng, Kecamatan Gambir, Kota Jakarta Pusat, Daerah Khusus Ibukota Jakarta 10160",0.007474304786957209,0.6736527912914667,1,1,1,1,0,630
SAKINNAH LAUNDRY,081234567891,"Jl. RS. Fatmawati Raya No.41, RT.1/RW.5, Cilandak Bar., Kec. Cilandak, Kota Jakarta Selatan, Daerah Khusus Ibukota Jakarta 12430",0.008059907360423502,0.6736873721313819,1,1,1,1,1,631
Lavare Laundry,081234567891,"Jl. Pluit Sakti No.111, RT.4/RW.6, Pluit, Kec. Penjaringan, Jkt Utara, Daerah Khusus Ibukota Jakarta 14450",0.002824048504396992,0.6754378780967683,1,1,0,1,1,632
Oxygen Eco Laundry,081234567891,"Jl. Mampang Prapatan VIII No.19A, RT.2/RW.2, Tegal Parang, Mampang Prapatan, South Jakarta City, Jakarta 12790",0.007285286898210064,0.6720178568779644,1,1,1,1,1,633
Laundry & CO,081234567891,"Jl. Danau Sunter Utara No.17, RT.16/RW.11, Sunter Agung, Kec. Tj. Priok, Jkt Utara, Daerah Khusus Ibukota Jakarta 14350",0.006407064002959095,0.6754823800604104,1,1,1,1,1,634
AIN Laundry Dry Clean & Wet Clean,081234567891,"Jl. Ciputat Raya No.18 B, RT.2/RW.9, Kby. Lama Sel., Kec. Kby. Lama, Kota Jakarta Selatan, Daerah Khusus Ibukota Jakarta 12240",0.0067061990628910495,0.6726272905215538,1,0,1,1,0,635
Sa'iki londri,081234567891,"Signature Park Grande, Apartement, Jl. Letjen M.T. Haryono No.kav 20, RT.4/RW.1, Cawang, Kec. Kramat jati, Kota Jakarta Timur, Daerah Khusus Ibukota Jakarta 13630",0.004411020620593953,0.673278650452434,0,1,1,1,0,636
Start Laundry Express,081234567891,"9, Jl. Gili Sampeng VI No.43, RW.3, Kb. Jeruk, Kec. Kb. Jeruk, Kota Jakarta Barat, Daerah Khusus Ibukota Jakarta 11530",0.012114336549924887,0.6754035834431136,0,0,1,0,0,637
Laundry Time Dharmawangsa,081234567891,"Jl. Meruya Ilir Raya No.36A, RT.4/RW.8, Srengseng, Kec. Kembangan, Kota Jakarta Barat, Daerah Khusus Ibukota Jakarta 11630",0.007036550576445699,0.6747291855181929,1,1,0,0,1,638
SYSAFA LAUNDRY,081234567891,"Jl. Warung Jati Barat No.21b, Jati Padang, Ps. Minggu, Kota Jakarta Selatan, Daerah Khusus Ibukota Jakarta 12540",0.0023439484959278944,0.6720807224600458,0,0,0,0,1,639
Laundry Time,081234567891,"Jl. Mandar III Gg. Musholah No.3, Pondok Karya, Pondok Aren, South Tangerang City, Banten 15225",0.006455200679269968,0.6735588745000269,0,0,0,1,0,640
ION COIN LAUNDRY - BAVARIAN,081234567891,"Jl. Masda 1 No.12C, RT.5/RW.9, Pejagalan, Kec. Penjaringan, Jkt Utara, Daerah Khusus Ibukota Jakarta 14450",0.0069646170094020965,0.6716948479842975,1,0,0,1,1,641
NOLARA LAUNDRY,081234567891,"Jalan Sunter Hijau Raya Blok E2 No.14, Sunter Jaya, Tj. Priok, Kota Jkt, Utara, 14350., RT.4/RW.10, Sunter Jaya, Tanjung Priok, RT.8/RW.10, Sunter Jaya, Kec. Tj. Priok, Jakarta, Daerah Khusus Ibukota Jakarta 14360",0.008974504210330525,0.6732693017012288,1,0,0,1,0,642
iconic xpress laundry,081234567891,"Jl. Boulevard Raya Blok I4 No.4, RT.11/RW.2, East Kelapa Gading, Kelapa Gading, North Jakarta City, Jakarta 14240",0.008227480902768924,0.6714359448131768,1,1,1,1,1,643
GRESS LAUNDRY SURABAYA,081234567891,"Jl. Gading Raya No.703, RT.5/RW.8, Pd. Bambu, Kec. Duren Sawit, Kota Jakarta Timur, Daerah Khusus Ibukota Jakarta 13430",0.0,0.6746492918535596,0,0,0,0,1,644
LAUNDRY ALL IN ONE-UR ONE STOP LAUNDRY SERVICES,081234567891,"Jl. Haji Nurisan No 22 Rt 02 / Rw 011 No 17E, RT.2/RW.11, Pd. Pinang, Kec. Kby. Lama, Jakarta, Daerah Khusus Ibukota Jakarta 12310",0.0039098381956201855,0.6714211108252952,1,1,1,1,1,645
Laundry Time Kertajaya,081234567891,"Gg. Kancil I No.23, RT.5/RW.2, Lenteng Agung, Jagakarsa, South Jakarta City, Jakarta 12610",0.006892954889781477,0.6746605485131738,1,1,0,0,0,646
Di Laundry,081234567891,"Jl. Pegambiran No.31, RT.9/RW.8, Rawamangun, Pulo Gadung, East Jakarta City, Jakarta 13220",0.008361756894583516,0.6737876327182821,1,1,1,1,1,647
ONLINE LAUNDRY,081234567891,"Jalan Green Lake City Rukan Amerika Latin Colombus A 21, RT.002/RW.009 Petir, Kec. Cipondoh, Banten, Daerah Khusus Ibukota Jakarta, Kota Tangerang, Banten 15147",0.007070029091925112,0.6730100646461379,1,1,1,1,1,648
Professional Laundry Surabaya - Marckalaundry,081234567891,"Perumahan Daan Mogot baru jl Gilimanuk blok JD no 43 A, RT.8/RW.12, Kalideres, Kec. Kalideres, Kota Jakarta Barat, Daerah Khusus Ibukota Jakarta 11480",0.005080590930181428,0.6749173529850445,1,1,1,1,1,649
INDOCLEAN SURABAYA,081234567891,"Jl. Kelapa Gading No.2a, RT.8/RW.2, Gandaria Sel., Kec. Cilandak, Kota Jakarta Selatan, Daerah Khusus Ibukota Jakarta 12420",0.005657688151066598,0.6735056915531219,1,0,1,0,1,650
The Daily Wash Nginden,081234567891,"Jl. Pembangunan III No.2B, RT.13/RW.1, Petojo Utara, Kecamatan Gambir, Kota Jakarta Pusat, Daerah Khusus Ibukota Jakarta 10130",0.004946495903315418,0.6755113802682304,1,1,1,1,1,651
TheDailyWash Ngagel Surabaya,081234567891,"Jl. Bekasi Timur Raya No.5A, RT.5/RW.8, Cipinang, Kec. Pulo Gadung, Kota Jakarta Timur, Daerah Khusus Ibukota Jakarta 13240",0.005565667474735414,0.6747693946879156,1,1,1,1,1,652
Laundry The Daily Wash Laundry Keputih,081234567891,"Jl. E Raya No.77, Kebon Kosong, Kemayoran, Central Jakarta City, Jakarta 10630",0.005819380332584556,0.6768316528873539,0,1,0,0,0,653
Loundry And Dry Cleaning,081234567891,"Apartemen Gading Greenhill lt.2 kios#8, RT.10/RW.3, Pegangsaan Dua, Kelapa Gading, North Jakarta City, Jakarta 14250",0.00875644144734311,0.6751856049073695,1,0,1,0,1,654
CLEAN LAUNDRY,081234567891,"Gedung Mitra Hadiprana, Parking Entry, Jl. Kemang Raya Jl. Kemang IV No.30, Bangka, Mampang Prapatan, South Jakarta City, Jakarta 12730",0.006316310081267651,0.6715987847958971,0,1,1,1,1,655
Daily Wash,081234567891,"Jl. Bintaro Utama 3A, Pondok Karya, Pondok Aren, South Tangerang City, Banten 15224",0.00902046930725886,0.6752614919643429,1,1,1,1,1,656
Laundry Arya,081234567891,"Jl. Mangga Besar IV No.7a, RT.5/RW.1, Taman Sari, West Jakarta City, Jakarta 11150",0.009814995913811408,0.674706052128732,1,0,1,1,1,657
Yuli laundry services,081234567891,"Jl. Cempaka Putih Tengah XVII No.F33, Cemp. Putih Tim., Kec. Cemp. Putih, Kota Jakarta Pusat, Daerah Khusus Ibukota Jakarta 10510",0.008163509793461032,0.6738732024104328,0,0,1,0,1,658
"Laundry satuan Dan Kiloan ""SONIA""",081234567891,"Ruko Arana IX 3 No. 19, Setia Asih, Kec. Tarumajaya, Kabupaten Bekasi, Jawa Barat 17215",0.010156386289226771,0.6731773405159087,0,0,0,1,0,659
The Daily Wash Dharmawangsa,081234567891,"QQXQ+5G8 LONDRENIA LAUNDRY EXPRESS, Jl. Kemanggisan Pulo, Palmerah, West Jakarta City, Jakarta 11480",0.007411328984866183,0.6747339075915058,1,0,1,1,1,660
Sintia Laundry & Dry cleaning,081234567891,"No Jl. Pulo Asem Utara Raya No.57, RT.11/RW.1, Jati, Kec. Pulo Gadung, Kota Jakarta Timur, Daerah Khusus Ibukota Jakarta 13220",0.011740010553875746,0.6739236188901438,1,0,0,1,1,661
Laundry Murah,081234567891,"Jl. Pondasi No.41 C, RT.1/RW.2, Kayu Putih, Pulo Gadung, East Jakarta City, Jakarta 13210",0.008145051368710243,0.6759316924907628,1,1,1,0,1,662
LONDREE LAUNDRY,081234567891,"Jl. Paseban Raya No.68, RT.17/RW.3, Paseban, Kec. Senen, Kota Jakarta Pusat, Daerah Khusus Ibukota Jakarta 10440",0.002979768842613306,0.6761163303270576,1,1,1,0,0,663
Laundry 35,081234567891,"Jl. Kemang Raya No.130d, RT.3/RW.2, Bangka, Kec. Mampang Prpt., Kota Jakarta Selatan, Daerah Khusus Ibukota Jakarta 12730",0.004219469222567329,0.6746813447148341,0,1,0,0,0,664
Noda Laundry Medan (Wet Cleaning & Dry Cleaning),081234567891,"Deretan BCA, sblh Indomaret, 2, Jl. Tebet Barat IX ps. Tb Barat No.34, Tebet Bar., Kec. Tebet, Kota Jakarta Selatan, Daerah Khusus Ibukota Jakarta 12810",0.987306937544653,0.003395266107194317,0,1,0,0,0,665
LaundryLab.,081234567891,,0.006279936126611707,0.6687366836936359,0,1,0,0,0,666
Nusantara Wash Coin Laundry,081234567891,"Jl. Jaksa No.20, RT.13/RW.2, Kb. Sirih, Kec. Menteng, Kota Jakarta Pusat, Daerah Khusus Ibukota Jakarta 10340",0.9901881709727878,0.003787198192141794,1,0,1,1,1,667
Everest Laundry & Dry Clean,081234567891,"Ruko French Walk G/26, Mall of Indonesia, RT.18, RT.18/RW.8, Klp. Gading Bar., Kec. Klp. Gading, Jkt Utara, Daerah Khusus Ibukota Jakarta 14240",0.9896140596735536,0.002131849158662824,0,1,1,1,1,668
Verona Dry Clean Laundry,081234567891,"Jl. Taman Cilandak Raya No.40, RT.12/RW.4, Cilandak Bar., Kec. Cilandak, Kota Jakarta Selatan, Daerah Khusus Ibukota Jakarta 12430",0.9897482451828938,0.0027017414004717466,1,1,1,1,0,669
Laundry Express Hijrah Laundry Medan,081234567891,"Mall Golden Truly, Jl. Gn. Sahari No.59, RT.2/RW.1, Gn. Sahari Sel., Kec. Kemayoran, Kota Jakarta Pusat, Daerah Khusus Ibukota Jakarta 10610",0.9911147115092982,0.002559316037729964,1,1,1,0,0,670
Davindo Laundry & Dry Clean,081234567891,"Jl. Rungkut Asri XV No.29, Kali Rungkut, Rungkut, Surabaya, East Java 60293",0.9899043274510072,0.0028212718623041866,0,1,1,1,0,671
517 Laundry,081234567891,"Jl. Raya Tenggilis No.132, Tenggilis Mejoyo, Kec. Tenggilis Mejoyo, Surabaya, Jawa Timur 60293",0.011577956442460624,0.675358842990919,1,0,0,0,0,672
Garuda Laundry Services,081234567891,"Jl. Prof. DR. Satrio Gg. Amsar No.62, RT.2/RW.6, Kuningan, Karet Kuningan, Setiabudi, South Jakarta City, Jakarta 12940",0.9864071798205261,0.003918366895270253,0,0,1,0,0,673
Mr. Clean Coin Laundry,081234567891,"Jl. Caman Raya No.23, RT.008/RW.001, Jatibening, Kec. Pd. Gede, Kota Bks, Jawa Barat 17412",0.9931118406813546,0.0027220129273199944,0,0,0,1,0,674
GO Laundry kapten muslim. Laundry Kiloan Siap 1 Hari&Express Siap 6 Jam,081234567891,"No Jl. Siwalankerto Sel., Siwalankerto, Kec. Wonocolo, Surabaya, Jawa Timur 60234",0.9916256660414929,0.0016977522978729453,1,0,1,1,1,675
Megoria Laundry & Dry Cleaning,081234567891,"Jl. Dharmawangsa No.88, Airlangga, Kec. Gubeng, Surabaya, Jawa Timur 60286",0.9897811808035277,0.002862721172493643,1,0,0,1,1,676
